{
  "schemaVersion": "angit-message-input/v1",
  "taskId": "tsk_frontend",
  "kind": "contract.updated",
  "summary": "The frozen contract is available; verify artifact and source identity before use.",
  "relatedTaskIds": [
    "tsk_backend"
  ],
  "artifactIds": [
    "art_contract"
  ],
  "commitOid": "aaaaaaaaaaaaaaaaaaaaaaaaaaaaaaaaaaaaaaaa"
}
